{
  "schemaVersion": 1,
  "timezone": "Australia/Melbourne",
  "generatedAt": "14 July 2026",
  "events": [
    {
      "id": "us-cpi-2026-07",
      "name": "US June CPI",
      "importance": "research-priority",
      "scheduledLabel": "14 July 2026 · 10:30 pm Melbourne",
      "scheduledAt": "2026-07-14T22:30:00+10:00",
      "timeStatus": "verified-melbourne",
      "state": "upcoming",
      "source": {"name": "US Bureau of Labor Statistics", "url": null},
      "assets": ["Gold", "Bonds", "US 10Y", "DXY", "USD", "Nasdaq"],
      "previous": {"value": "Research verification required", "status": "not-sourced", "source": null},
      "consensus": {"value": "Not sourced from an official free feed", "status": "not-sourced", "source": null},
      "actual": {"value": "Pending", "status": "pending", "source": "US Bureau of Labor Statistics"},
      "scenarios": [{"label": "Hotter inflation", "interpretation": "Yields and USD higher; pressure on gold, bonds and long-duration equities."}],
      "reactions": {
        "immediate": {"label": "Immediate", "value": "Pending", "status": "pending", "observedAt": null},
        "close": {"label": "Melbourne / primary close", "value": "Pending", "status": "pending", "observedAt": null},
        "day1": {"label": "+1 trading day", "value": "Pending", "status": "pending", "observedAt": null},
        "day5": {"label": "+5 trading days", "value": "Pending", "status": "pending", "observedAt": null}
      },
      "verdict": "Too early"
    }
  ]
}
